{
  "$schema": "./historical-natal-runtime-closure-v1.schema.json",
  "schemaVersion": "1.0.0",
  "gate": "hakimi-bazi-core-historical-natal-runtime-closure-v1",
  "scope": "current_checkout_runtime_closure_not_historical_binary_or_expert_attestation",
  "roots": [
    "packages/bazi-core/src/historical-natal-chart-executor-0.4.0.ts",
    "packages/bazi-core/src/index.ts"
  ],
  "workspaceSources": [
    {
      "path": "packages/bazi-core/src/historical-natal-chart-executor-0.4.0.ts",
      "packageManifestPath": "packages/bazi-core/package.json",
      "lfUtf8Sha256": "09ce6e7516e38359ed37c7bc4b71c27c00f0be21244c2ecefd3966ff89450117",
      "byteLength": 26573,
      "edges": [
        {
          "kind": "static-import",
          "specifier": "./unsupported-calculation-error",
          "targetKind": "workspace-source",
          "target": "packages/bazi-core/src/unsupported-calculation-error.ts"
        },
        {
          "kind": "static-import",
          "specifier": "@hakimi/contracts",
          "targetKind": "workspace-source",
          "target": "packages/contracts/src/index.ts"
        },
        {
          "kind": "static-import",
          "specifier": "@hakimi/integrity",
          "targetKind": "workspace-source",
          "target": "packages/integrity/src/index.ts"
        },
        {
          "kind": "static-import",
          "specifier": "@hakimi/luck-core",
          "targetKind": "workspace-source",
          "target": "packages/luck-core/src/index.ts"
        },
        {
          "kind": "static-import",
          "specifier": "@hakimi/time-core",
          "targetKind": "workspace-source",
          "target": "packages/time-core/src/index.ts"
        },
        {
          "kind": "static-import",
          "specifier": "lunar-typescript",
          "targetKind": "external-package",
          "target": "node_modules/lunar-typescript"
        }
      ]
    },
    {
      "path": "packages/bazi-core/src/index.ts",
      "packageManifestPath": "packages/bazi-core/package.json",
      "lfUtf8Sha256": "4c9b7fc5a16cbd3e3f5ca0bed90cd950b8ef3750f204427a332a6c1a1b4e7e7f",
      "byteLength": 46847,
      "edges": [
        {
          "kind": "static-export",
          "specifier": "./unsupported-calculation-error",
          "targetKind": "workspace-source",
          "target": "packages/bazi-core/src/unsupported-calculation-error.ts"
        },
        {
          "kind": "static-export",
          "specifier": "@hakimi/integrity",
          "targetKind": "workspace-source",
          "target": "packages/integrity/src/index.ts"
        },
        {
          "kind": "static-import",
          "specifier": "./historical-natal-chart-executor-0.4.0",
          "targetKind": "workspace-source",
          "target": "packages/bazi-core/src/historical-natal-chart-executor-0.4.0.ts"
        },
        {
          "kind": "static-import",
          "specifier": "./unsupported-calculation-error",
          "targetKind": "workspace-source",
          "target": "packages/bazi-core/src/unsupported-calculation-error.ts"
        },
        {
          "kind": "static-import",
          "specifier": "@hakimi/contracts",
          "targetKind": "workspace-source",
          "target": "packages/contracts/src/index.ts"
        },
        {
          "kind": "static-import",
          "specifier": "@hakimi/integrity",
          "targetKind": "workspace-source",
          "target": "packages/integrity/src/index.ts"
        },
        {
          "kind": "static-import",
          "specifier": "@hakimi/luck-core",
          "targetKind": "workspace-source",
          "target": "packages/luck-core/src/index.ts"
        },
        {
          "kind": "static-import",
          "specifier": "@hakimi/time-core",
          "targetKind": "workspace-source",
          "target": "packages/time-core/src/index.ts"
        },
        {
          "kind": "static-import",
          "specifier": "lunar-typescript",
          "targetKind": "external-package",
          "target": "node_modules/lunar-typescript"
        }
      ]
    },
    {
      "path": "packages/bazi-core/src/unsupported-calculation-error.ts",
      "packageManifestPath": "packages/bazi-core/package.json",
      "lfUtf8Sha256": "3427769eaedd105af4a1ce7856cd91dfeb1f277529bf1412c750efb9ceba018e",
      "byteLength": 163,
      "edges": []
    },
    {
      "path": "packages/contracts/src/index.ts",
      "packageManifestPath": "packages/contracts/package.json",
      "lfUtf8Sha256": "674a3fe1e2b3cd4fc99e481a758966a320ddc3c1113a9471eba190851d15e041",
      "byteLength": 244747,
      "edges": [
        {
          "kind": "static-import",
          "specifier": "@hakimi/tzdb-core",
          "targetKind": "workspace-source",
          "target": "packages/tzdb-core/src/index.ts"
        },
        {
          "kind": "static-import",
          "specifier": "zod",
          "targetKind": "external-package",
          "target": "node_modules/zod"
        }
      ]
    },
    {
      "path": "packages/integrity/src/index.ts",
      "packageManifestPath": "packages/integrity/package.json",
      "lfUtf8Sha256": "339054573ac1bb70d18ad3250b425e41d2c865dd47cf14086bd869512342ba9b",
      "byteLength": 11169,
      "edges": []
    },
    {
      "path": "packages/luck-core/src/index.ts",
      "packageManifestPath": "packages/luck-core/package.json",
      "lfUtf8Sha256": "d3bbd22585ed37cfc1009e7efc62e95328aa561d2bddab1fa4fac53aa57c2710",
      "byteLength": 43695,
      "edges": [
        {
          "kind": "static-import",
          "specifier": "lunar-typescript",
          "targetKind": "external-package",
          "target": "node_modules/lunar-typescript"
        }
      ]
    },
    {
      "path": "packages/time-core/src/index.ts",
      "packageManifestPath": "packages/time-core/package.json",
      "lfUtf8Sha256": "5d8980e980477215c1dfcb202d2104783306ef74511cec23fb15dfe36c67452b",
      "byteLength": 52377,
      "edges": [
        {
          "kind": "static-import",
          "specifier": "@hakimi/contracts",
          "targetKind": "workspace-source",
          "target": "packages/contracts/src/index.ts"
        },
        {
          "kind": "static-import",
          "specifier": "@hakimi/tzdb-core",
          "targetKind": "workspace-source",
          "target": "packages/tzdb-core/src/index.ts"
        },
        {
          "kind": "static-import",
          "specifier": "@js-temporal/polyfill",
          "targetKind": "external-package",
          "target": "node_modules/@js-temporal/polyfill"
        },
        {
          "kind": "static-import",
          "specifier": "lunar-typescript",
          "targetKind": "external-package",
          "target": "node_modules/lunar-typescript"
        }
      ]
    },
    {
      "path": "packages/tzdb-core/src/artifacts/iana-2025b.ts",
      "packageManifestPath": "packages/tzdb-core/package.json",
      "lfUtf8Sha256": "b1236071105653538a259d929a57e7cd2bb97928429cefaef2ead9dd5019e613",
      "byteLength": 396,
      "edges": [
        {
          "kind": "static-import",
          "specifier": "moment-timezone-2025b/data/packed/latest.json",
          "targetKind": "external-package",
          "target": "node_modules/moment-timezone-2025b"
        }
      ]
    },
    {
      "path": "packages/tzdb-core/src/index.ts",
      "packageManifestPath": "packages/tzdb-core/package.json",
      "lfUtf8Sha256": "7c144f6446b3fdba55f7b7b947fe242348ba5010025af36868c39436bfea638e",
      "byteLength": 7819,
      "edges": [
        {
          "kind": "dynamic-import",
          "specifier": "./artifacts/iana-2025b.ts",
          "targetKind": "workspace-source",
          "target": "packages/tzdb-core/src/artifacts/iana-2025b.ts"
        },
        {
          "kind": "static-export",
          "specifier": "./packed-resolver.ts",
          "targetKind": "workspace-source",
          "target": "packages/tzdb-core/src/packed-resolver.ts"
        },
        {
          "kind": "static-import",
          "specifier": "./packed-resolver.ts",
          "targetKind": "workspace-source",
          "target": "packages/tzdb-core/src/packed-resolver.ts"
        },
        {
          "kind": "static-import",
          "specifier": "moment-timezone",
          "targetKind": "external-package",
          "target": "node_modules/moment-timezone"
        }
      ]
    },
    {
      "path": "packages/tzdb-core/src/packed-resolver.ts",
      "packageManifestPath": "packages/tzdb-core/package.json",
      "lfUtf8Sha256": "bc13da5d2d9b8309aaad972662f8a31761a40afffbd9226bdf80159d43e5081f",
      "byteLength": 8495,
      "edges": [
        {
          "kind": "static-import",
          "specifier": "moment-timezone",
          "targetKind": "external-package",
          "target": "node_modules/moment-timezone"
        }
      ]
    }
  ],
  "workspaceManifests": [
    {
      "path": "packages/bazi-core/package.json",
      "packageName": "@hakimi/bazi-core",
      "version": "0.1.0",
      "exports": "./src/index.ts",
      "lfUtf8Sha256": "ee2e5832809c10cb90a12442c024855bc2b0e92fd0901237dc4482be638bdfab",
      "byteLength": 303,
      "dependencies": [
        {
          "request": "@hakimi/contracts",
          "range": "*",
          "targetKind": "workspace-manifest",
          "target": "packages/contracts/package.json"
        },
        {
          "request": "@hakimi/integrity",
          "range": "*",
          "targetKind": "workspace-manifest",
          "target": "packages/integrity/package.json"
        },
        {
          "request": "@hakimi/luck-core",
          "range": "*",
          "targetKind": "workspace-manifest",
          "target": "packages/luck-core/package.json"
        },
        {
          "request": "@hakimi/time-core",
          "range": "*",
          "targetKind": "workspace-manifest",
          "target": "packages/time-core/package.json"
        },
        {